"ad_id","post_date","phone","company","subject","location","category","position","platform","type","level","experience","education","view","applied","expired_date","body"
"","06-06-2017","","Công Ty TNHH MTV ASAHI TEC VN","Kiến Trúc Sư (Tiếng Nhật N3), Được Đào Tạo Tại Nhật Bản","Địa chỉ: VPHCM: Phòng 1011, Lầu 10, Zen Plaza, 54 - 56 Nguyễn Trãi, Q.1, Tp.HCMVPHN: P.309A, 649 Kim Mã, Ba Đình, HN","Kiến trúc/Nội thất, Sinh viên/Mới tốt nghiệp/Thực tập","","","","Nhân viên chính thức","Dưới 1 năm","Đại học","1,011","","18-07-2017","Mô tảCông ty 100% vốn đầu tư của Nhật Bản, cần tuyển KIẾN TRÚC SƯ làm việc tại văn phòng trung tâm Hồ Chí Minh.- Thiết kế ý tưởng.- Thiết kế chi tiết.- Phối hợp với các chuyên gia để đưa ra phương án thiết kế tối ưu và hiệu quả nhất.- Triển khai thiết kế theo sự phân công của Giám đốc dự án- Ứng viên được chọn sẽ được sang Nhật training 1 năm sau đó về VN làm việc.- Chi tiết trao đổi trong buổi phỏng vấnSố lượng: 01 người.Yêu cầu- Giới tính: Nam/Nữ- Tuổi: 23 trở lên- Trình độ: Tốt nghiệp Đại học chuyên ngành kiến trúc- Ngoại ngữ: tiếng Nhật N3- Kinh nghiệm: ưu tiên ứng viên có kinh nghiệm thiết kế các sản phẩm công trình của Nhật- Kỹ năng: Sử dụng phần mềm thiết kế Auto CAD (2D), JW CAD (2D) – Phần mềm CAD của NhậtThời gian làm việc: thứ 2 ~ thứ 6Quyền lợi- Theo quy định của công tyHạn nộp18-07-2017Hình thức nộpBấm ""NỘP HỒ SƠ"" để ứng tuyểnNộp hồ sơ"
"","06-06-2017","","CÔNG TY TNHH ĐT VÀ XD THIÊN PHỐ","Kế Toán Công Nợ","Địa chỉ: B2-2 (SỐ 2), KHU DÂN CƯ NAM VIÊN, PHÚ MỸ HƯNG, P.TÂN PHÚ, QUẬN 7, TP.HCM","Kiến trúc/Nội thất, Tài chính/Kế toán/Kiểm toán, Xây dựng","","","","Nhân viên chính thức","Dưới 1 năm","Cao đẳng","1,894","","12-06-2017","Mô tả- Theo dõi và thực hiện các công việc kế toán công nợ phải thu và phải trả- Chịu trách nhiệm quản lý và kiểm tra, đối chiếu dữ liệu công nợ và lên báo cáo, tổng hợp công nợ- Đôn đốc và trực tiếp tham gia thu hồi nợ - Thực hiện các công việc khác do ban lãnh đạo phân công Chi tiết công việc và mức lương sẽ được trao đổi cụ thể khi phỏng vấnYêu cầu- Chỉ tuyển Nam- Thành thạo excel, vi tính văn phòng.- Cẩn thận chịu khó, nhiệt tình và trách nhiệm- Giao tiếp tốt- Trung thực, hòa đồng và ham học hỏiQuyền lợi- Các quyền lợi của người lao động theo qui định của nhà nước - Thưởng thêm theo công trình- Thưởng thêm theo chính sách công ty- Được đi du lịch hằng năm- Được làm việc trong môi trường năng động - Có cơ hội thăng tiếnHạn nộp12-06-2017Hình thức nộpBấm ""NỘP HỒ SƠ"" để ứng tuyểnNộp hồ sơ"
"","06-06-2017","","Công Ty Cổ Phần Nội Thất Vua","Kiến Trúc Sư","Địa chỉ: Vinhomes Central park , Park 6 A, Lầu 6, Phòng 603 số 208 Nguyễn Hữu Cảnh, Quận Bình Thạnh,, TP. HCM","Kiến trúc/Nội thất","","","","Nhân viên chính thức","3 năm","Đại học","173","","30-06-2017","Mô tả- Lên ý tưởng thiết kế & triển khai hồ sơ kiến trúc nội - ngoại thất công trình.- Khảo sát, đo đạc hiện trạng công trình.- Làm việc trực tiếp với đơn vị thi công & xưởng sản xuất để tạo ra sản phẩm hoàn thiện nhất- Tiếp xúc và lấy thông tin yêu cầu thiết kế từ khách hàng.- Thực hiện theo đúng tiến độ, bàn giao cho khách hàng theo đúng thời gian.- Theo dõi, giám sát công việc để đảm bảo tiến độ công việc+ Lên phương án thiết kế: mặt bằng công năng; phối cảnh kiến trúc; nội thất.+ Diễn họa 3D và triển khai chi tiết kỹ thuật thi công.+ Lên phương án thiết kế tổng quan + Lên phương án thiết kế kiến trúc công trình biệt thự, văn phòng, đặc biệt là nhà xưởng+ Kết nối với các bộ môn trong quá trình thiết kế phương án+ Kiểm tra, quản lý, rà soát, bóc tách hồ sơ bản vẽ thiết kế - Các công việc khác theo yêu cầu công ty.Yêu cầu- Sử dụng thành thạo các phần mềm chuyên ngành, nắm rõ các tiêu chuẩn, quy chuẩn trong thiết kế Kiến trúc.- Năng động, nhiệt huyết, trung thực và có trách nhiệm đối với công việc.- Có khả năng chịu được áp lực công việc cao, có thể làm thêm ngoài giờ & chấp nhận đi công tác xa.- Ưu tiên KTS tốt nghiệp từ ĐH Kiến trúc TP. HCM & ĐH Văn Lang – Khoa Kiến trúc. ( khoa kiến trúc nội thất )Quyền lợiQuyền lợi được hưởng- Mức lương: Thỏa thuận (10 – 15 triệu).- Được hưởng các quyền lợi theo quy định của Luật lao động và Quy chế của Công ty.- Nhân viên luôn được Công ty khuyến khích & tạo điều kiện thỏa sức sáng tạo các công trình với ý tưởng đẹp – lạ, không gò bó – rập khuôn.Hạn nộp30-06-2017Hình thức nộpBấm ""NỘP HỒ SƠ"" để ứng tuyểnNộp hồ sơ"
"","31-05-2017","","CÔNG TY TNHH NEW DOOR","Thiết Kế Nội Thất","Địa chỉ: 142 Hoa Lan, P2, Phú Nhuận","Kiến trúc/Nội thất","","","","Nhân viên chính thức","1 năm","Cao đẳng","95","","30-06-2017","Mô tả- Triển khai bản vẽ- Thiết kế 2D, 3D- Gặp khách hàng, tư vấn với khách hàngYêu cầu- Thành thạo các công cụ, dụng cụ, phần mềm thiết kế chuyên ngành.- Năng động, chịu khó, nhiệt tình, có trách nhiệm trong công việc.- Có thể đi tỉnh để khảo sát hiện trạng thực tế mặt bằng.Quyền lợi- Thưởng công trình- Thưởng tháng 13- Thưởng lễ, tết,...Hạn nộp30-06-2017Hình thức nộpBấm ""NỘP HỒ SƠ"" để ứng tuyểnNộp hồ sơ"
"","01-06-2017","","Công ty TNHH Kiến Trúc Nhật Hoàng","Nhân Viên Thiết Kế Nội Thất","Địa chỉ: 002 Hẻm 686, Võ Văn Kiệt, Phường 1, Quận 5, TpHCM","Kiến trúc/Nội thất, Thiết kế/Mỹ thuật, Xây dựng","","","","Nhân viên chính thức","2 năm","Đại học","21","","30-06-2017","Mô tả- Lên bản vẽ thiết kế nội thất các công trình biệt thự, dinh thự, nhà hàng, khách sạn… theo phong cách cổ điển, bán cổ điển, hiện đại.- Thiết kế nội thất theo yêu cầu của Chủ đầu tư- Triển khai bản vẽ thiết kế cho các đơn vị thi công- Giám sát thực hiện theo bản vẽYêu cầu- Tốt nghiệp Đại Học các chuyên ngành liên quan đến Kiến trúc, Thiết kế Nội thất- Thành thạo Autocad, 3Dmax, SketchUp, Photoshop- Diễn họa tốt bản vẽ.- Ưu tiên ứng viên thành thạo SketchUp, đã thiết kế các công trình cổ điển, bán cổ điển.Quyền lợi- Lương, thưởng hấp dẫn, xứng đáng với năng lực- Môi trường làm việc chuyên nghiệp, thân thiệnHạn nộp30-06-2017Hình thức nộpBấm ""NỘP HỒ SƠ"" để ứng tuyểnNộp hồ sơ"
"","06-06-2017","","Công ty TNHH MTV Zen Homes","Họa Viên Autocad","Địa chỉ: 233B - Bùi Thị Xuân - P1 - Q. Tân Bình - TPHCM","Kiến trúc/Nội thất","","","","Nhân viên chính thức","2 năm","Cao đẳng","13","","10-06-2017","Mô tả. Khai triển các sản phẩm đồ gỗ nội thất để sản xuất . Chịu trách nhiệm kiểm tra đối chiếu bản vẽ ở xưởng và thực tế tại công trình . Hỗ trợ giám sát thiết kế . Các công việc liên quan đến kỹ thuậtYêu cầu. Nam có kinh nghiệm từ 02 năm trở lên về khai triển đồ nội thất . Có phương tiện đi lại . Giao tiếp tốt . Sử dụng thành thạo AutoCad, biết sketchup là một lợi thế. Có nhận hồ sơ sinh viên mới tốt nghiệp có kỹ năng tốtQuyền lợi. Lương 7.000.000 VND + thưởng ( thu nhập 7-8tr/ tháng ). Làm việc 06 ngày / tuần. 8h / ngày. Làm việc tại VP 233B Bùi Thị Xuân Tân Bình HCM. Phụ cấp tăng ca, công tác, thưởng lễ tết . Các chế độ khác theo quy chế công tyHạn nộp10-06-2017Hình thức nộpBấm ""NỘP HỒ SƠ"" để ứng tuyểnNộp hồ sơ"
"","06-06-2017","","Công ty liên hợp xây dựng Vạn Cường","Kiến Trúc Sư - Hà Nội","Địa chỉ: Công ty LHXD Vạn Cường - 33 Phan Chu Trinh - Hoàn Kiếm - Hà Nội","Kiến trúc/Nội thất, Xây dựng","","","","Nhân viên chính thức","3 năm","Đại học","102","","30-06-2017","Mô tả- Tham gia thiết kế các dự án xây dựng từ giai đoạn triển khai đến khi hoàn tất;- Trực tiếp tư vấn cho lãnh đạo các phương án thiết kế Quy hoạch, Kiến trúc, Nội thất các công trình xây dựng dân dụng, công nghiệp;- Xây dựng các bản thiết kế concept, thiết kế cơ sở, các bản vẽ triển khai thi công và những công việc khác theo sự phân công của cấp trên…- Làm việc trực tiếp với các kỹ sư công trình, các đơn vị thầu phụ liên quan đến công việc được giao phụ trách và báo cáo cho cán bộ quản lý, lãnh đạo;- Nghiên cứu và cập nhật các vật liệu kiến trúc mới cũng như các tiêu chuẩn, quy chuẩn thiết kế ứng dụng trong thực tiễn.- Trực tiếp giám sát thi công tại công trình;Yêu cầu- Tốt nghiệp ĐH chính quy các trường công lập (ĐH Kiến trúc HN, XD HN) - Chuyên ngành Kiến trúc - TN loại Khá trở lên;- Thông thạo các tiêu chuẩn, các quy định liên quan đến thiết kế kiến trúc, PCCC và các quy định liên quan khác…- Sử dụng thành thạo vi tính văn phòng, các phần mềm đồ họa, thiết kế thông dụng…- Đã tham gia thiết kế nhà cao tầng (15 tầng trở lên)…Quyền lợi- Lương theo thỏa thuận (tùy thuộc vào năng lực, kinh nghiệm làm việc);- Chế độ lương, thưởng theo quy chế lương, thưởng của Công ty và của Nhà nước;- Tham gia đầy đủ BHXH, BHYT, BHTN theo quy định, đảm bảo lợi ích cho người lao động;- Được hưởng các chế độ ưu đãi, các ngày nghỉ lễ, tết theo quy định của Công ty và của Nhà nước;- Môi trường làm việc năng động, chuyên nghiệp.Hạn nộp30-06-2017Hình thức nộpBấm ""NỘP HỒ SƠ"" để ứng tuyểnNộp hồ sơ"
"","01-06-2017","","Công ty cổ phần xây dựng và đầu tư Phú Sĩ","Kỹ Sư Kinh Tế Xây Dựng","Địa chỉ: 585/6c Sư Vạn Hạnh, P13, Q10","Kiến trúc/Nội thất, Xây dựng","","","","Nhân viên chính thức","1 năm","Đại học","23","","31-07-2017","Mô tả•Triển khai bản vẽ thi công (shop drawing)•Bóc tách khối lượng hạng mục•Các công việc khác liên quan.Làm việc tại Văn Phòng Cty.Yêu cầu•Tốt nghiệp đại học chuyên ngành.•Ưu tiên có kinh nghiệm trên 2 năm trong thiết kế, làm bản vẽ thi công, giám sát thi công,..•Thông minh, năng động và sáng tạo.•Làm việc tại TP.HCMQuyền lợi+ Chế độ bảo hiểm, bảo hiểm y tế đầy đủ theo quy định của pháp luật.+ Chế độ nâng lương, khen thưởng theo năm.+ Làm việc giờ hành chính, Nếu tăng ca thì được hưởng ngoài giờHạn nộp31-07-2017Hình thức nộpBấm ""NỘP HỒ SƠ"" để ứng tuyểnNộp hồ sơ"
"","07-06-2017","","Công ty TNHH Thế Giới Xây dựng","Họa Viên Kiến Trúc Kinh Nghiệm","Địa chỉ: 74 Đường 30/4 , P.Tân Thành, Q.Tân Phú","Kiến trúc/Nội thất, Xây dựng","","","","Nhân viên chính thức","2 năm","Không yêu cầu","719","","30-06-2017","Mô tả- Triển khai bản vẽ kiến trúc.- Triển khai bản vẽ từ phối cảnh 3D.- Triển khai hồ sơ thiết kế;- Vẽ phối cảnh nội thất, ngoại thất.- Đo vẽ hiện trạng công trình kiến trúc.Yêu cầu- Sử dụng thành thạo các phần mềm kiến trúc như 3Ds Max ,Autocad, Photoshop, Sketchup, Render Vray- Ưu tiên ứng viên biết Revit- Tính tự chủ và độc lập cao.- Chịu áp cường độ làm việc cao.- Bằng cấp Trung Cấp, Trung Học chuyên Nghiệp, Cao đẳng…..Quyền lợiĐược hưởng tất cả những quyền lợi của công ty.Cụ thể trao đổi khi phỏng vấnHạn nộp30-06-2017Hình thức nộpBấm ""NỘP HỒ SƠ"" để ứng tuyểnNộp hồ sơ"
"","06-06-2017","","CÔNG TY TNHH XÂY DỰNG MTV PHAN PHÚ GIA","Kỹ Sư Công Trình Xây Dựng","Địa chỉ: Lầu 19, phòng 1901, 37 Tôn Đức Thắng, Phường Bến Nghé","Kiến trúc/Nội thất, Kinh doanh, Xây dựng","","","","Nhân viên chính thức","2 năm","Cao đẳng","1,064","","20-06-2017","Mô tảĐọc hiểu bản vẽ, tính toán, bóc tách khối lượng công việcLập biện pháp, tiến độ thi côngKiểm tra trình tự biện pháp thi công, tiến độ và chất lượng thi công các hạng mụcTham gia quá trình nghiệm thu chuyển bước thi công, nghiệm thu giai đoạn, nghiệm thu hoàn thành…Kiểm tra hồ sơ thanh toán, hồ sơ hoàn công …Các công việc khác theo yêu cầu của ban Giám đốc Công ty.Trao đổi cụ thể khi phỏng vấnYêu cầuTốt nghiệp Cao Đẳng, Đại học chính quy trở lên, chuyên ngành xây dựng, kỹ thuật. Có kinh nghiệm trong lĩnh vực xây dựng từ 01 năm trở lên;Có khả năng giao tiếng, đọc - hiểu tài liệu tiếng Anh chuyên ngànhƯu tiên sử dụng thành thạo các phần mềm tin học văn phòng và các phần mềm chuyên ngành (Auto Cad, Ms project…)Có tinh thần trách nhiệm, khả năng làm việc độc lập và chịu được áp lực cao.Chuyên cần, siêng năng, hoạt bát trong công việcThời gian làm việc theo tính chất công việc và theo sự phân công của Chỉ huy trưởngKhả năng điều phối công việc tốt và chấp nhận đi công tác xa.Quyền lợiCác chế độ lương thưởng theo chính sách của Công TyHạn nộp20-06-2017Hình thức nộpBấm ""NỘP HỒ SƠ"" để ứng tuyểnNộp hồ sơ"
"","06-06-2017","","Công ty CP VLXD & Nhà thông minh Phú Khang Gia","Nhân Viên Thiết Kế Nội Thất Tại Tân Bình","Địa chỉ: 2/19A Quách Văn Tuấn,P.12, Q.Tân Bình , TP.HCM MST: 0305265949","Kiến trúc/Nội thất, Thiết kế/Mỹ thuật, Xây dựng","","","","Nhân viên chính thức","1 năm","Cao đẳng","278","","17-06-2017","Mô tả- Khảo sát hiện trạng, lập ý tưởng tư vấn cho khách hàng.- Tổng hợp thiết kế nội thất- Phối hợp phòng kinh doanh để tư vấn cho khách hàng những sản phẩm tốt nhất.Những công việc khác sẽ trao đổi chi tiết khi phỏng vấn.Yêu cầuTốt nghiệp Cao đẳng hoặc Đại học ngành nghề thiết kế hoặc ngành nghề liên quan.Trung thực, chăm chỉ, nhiệt tình và có trách nhiệm cao trong công việc.Ứng viên có kinh nghiệm về vẽ công trình cổ điển hoặc bán cổ điển là 1 lợi thế.Quyền lợi- Thu nhập hấp dẫn theo năng lực, cụ thể trao đổi khi phỏng vấn- Ứng viên được làm việc trong một môi trường năng động, đoàn kết với đội ngũ nhân viên trẻ, nhiệt huyết, cơ hội thăng tiến và phát triển chuyên môn cao.- Quyền lợi người lao động theo pháp luật hiện hành- Chế độ và quyền lợi ưu đãi theo quy định công ty- Lương tháng 13.- Thưởng định kỳ cho các kỳ lễ, tết...- Phúc lợi: Tham gia BHXH, BHYT, BHTN.- Nghỉ lễ, phép hàng năm theo quy định Luật Lao động.Hạn nộp17-06-2017Hình thức nộpBấm ""NỘP HỒ SƠ"" để ứng tuyểnNộp hồ sơ"
"","31-05-2017","","CTY TNHH DAI SHENGENTERPRISE VN","Nhân Viên Thiết Kế Nội Thất 3D / 2D","Địa chỉ: TT UYÊN HƯNG-TÂN UYÊN-BÌNH DƯƠNG","Kiến trúc/Nội thất, Thiết kế/Mỹ thuật","","","","Nhân viên chính thức","1 năm","Trung cấp","1,309","","31-07-2017","Mô tả- Phát triển ý tưởng thiết kế nội thất gỗ trên các phần mềm thiết kế chuyên dụng như Autocad, 3dmax, photoshop và phần mềm văn phòng.- Thiết kế sản phẩm nội thất theo yêu cầu của cấp trên và khách hàng- Đề xuất ý tưởng, phương án thiết kế- Đảm bảo chất lượng bản vẽ Họa viên triển khai nội thất 2D:- Triển khai bản vẽ kỹ thuật 2D để sản xuất đồ gỗ- Đảm bảo chất lượng và thời gian giao hàng theo yêu cầu của khách hàng.- Thực hiện các nghiệp vụ và công việc khác theo sự phân công của trưởng nhóm thiết kế.Yêu cầu- Biết vẽ thông thạo Autocad, 3DMAX,Exel, Photoshop...- Trình độ trung cấp trở lên - Kinh nghiệm1~2 năm- Tỷ mỉ , hòa đồng, chăm chỉ, có tinh thần cầu tiến- Chịu được áp lực - Thông thạo vi tính văn phòng , trình bày văn bản- Thành thạo tin học văn phòng và các phần mềm liên quan.- Ham học hỏi, chịu khó và làm việc lâu dài. Họa viên triển khai nội thất 2D :+ Sử dụng thành thạo các chương trình AUTOCAD, SKETCHUP + Có kinh nghiệm làm việc trong ngành nội thất gỗ 1 năm trở lên. Có kiến thức về cấu tạo đồ nội thất,vật liệuChú ý : Khi Đến Phỏng vấn mang theo hồ sơ Tất cả giấy tờ phải có công chứng và không quá 6 thángQuyền lợi- Lương Thỏa Thuận theo năng lực và kinh nghiệm;công việc lâu dài, ổn định- Công ty có hỗ trợ cơm trưa .- Lương và chế độ phúc lợi tốt - Được hưởng đầy đủ chế độ theo quy định của nhà nước BHXH, BHYT, BHTN, Tháng lương thứ 13 , phép năm, lễ tết ...Hạn nộp31-07-2017Hình thức nộpBấm ""NỘP HỒ SƠ"" để ứng tuyểnNộp hồ sơ"
"","01-06-2017","","KHÁCH SẠN GRAND TOURANE","Thợ Mộc","Địa chỉ: 252 Võ Nguyên Giáp, Q. Sơn Trà, TP. Đà Nẵng","Kiến trúc/Nội thất","","","","Nhân viên chính thức","2 năm","Trung học","24","","30-06-2017","Mô tả- Bảo trì, sửa chữa đồ gỗ, đồ mộc của Khách sạn - Thực hiện các nhiệm vụ liên quan khác theo yêu cầu của lãnh đạo đơn vị. - Bảo trì các trang thiết bị của khách sạn.Yêu cầu- Có kinh nghiệm trong lĩnh vực bảo trì thiết bị nội thất- Đã cứng tay nghềQuyền lợi- Được training quy trình làm việc ở khách sạn 5*- Môi trường làm việc chuyên nghiệp và thân thiện- Lương thứ 13, thưởng Tết và các ngày lễ lớn trong năm- Các hoạt động Team building, Tiệc lễ, Hội thao, Văn nghệ- Nhiều cơ hội thăng tiến- Các quyền lợi khác theo quy định chungHạn nộp30-06-2017Hình thức nộpBấm ""NỘP HỒ SƠ"" để ứng tuyểnNộp hồ sơ"
"","02-06-2017","","CÔNG TY CỔ PHẦN TƯ VẤN KIẾN TRÚC XÂY DỰNG KIẾN LONG","Họa Viên Kiến Trúc","Địa chỉ: Số 8 Đường số 17, Phường An Lạc A, Quận Bình Tân, TP Hồ Chí Minh","Kiến trúc/Nội thất, Xây dựng","","","","Nhân viên chính thức","2 năm","Cao đẳng","442","","08-06-2017","Mô tả- Vẽ phối cảnh nội ngoại thất-Thiết kế bản vẽ theo đơn hàng của công ty.- Thiết kế nhà ở công trình dân dụng, biệt thư, nhà phố- Chi tiết trao đổi trực tiếp khi phỏng vấnYêu cầu- Có thể triển khai các bản vẽ kỹ thuật, diễn họa tốt- Thành thạo các phần mềm thông dụng: Cad, Max, Shop...- Sáng tạo, trách nhiệm, nhiệt tình, có mong muốn phát triển bản thân.Quyền lợi- Lương cao theo năng lực ứng viên- Quyền lợi đầy đủ theo qui định Nhà nướcHạn nộp08-06-2017Hình thức nộpBấm ""NỘP HỒ SƠ"" để ứng tuyểnNộp hồ sơ"
"","06-06-2017","","CÔNG TY TNHH TƯ VẤN THIẾT KẾ XÂY DỰNG SHUNCO","Nhân Viên Thiết Kế Mỹ Thuật","Địa chỉ: 124 Đường 9A , KDC Trung Sơn","Kiến trúc/Nội thất, Thiết kế/Mỹ thuật","","","","Nhân viên chính thức","1 năm","Cao đẳng","2,380","","30-07-2017","Mô tả* Thiết kế theo yêu cầu của công ty (các chương trình sản phẩm mới..)+ Các chương trình công ty+ Ý tưởng thiết kế+ Poster+ Tờ rơi, tem, nhãn+ standee, brochue...phong cách: trẻ trung, năng động, sáng tạo, màu sắc tươi sáng.....Yêu cầu- Sử dụng tốt các phần mềm thiết kế đồ họa như: Photoshop, Illustrator, Corel,... - Sáng tạo, có thẩm mỹ cao, có cái nhìn tinh tế trong mỹ thuật về màu sắc, không gian, etc.- Tư duy tốt, thao tác nhanh nhẹn- Có khả năng làm việc theo nhóm và làm việc độc lậpLàm việc tại: 23, ĐƯỜNG SỐ 11, KHU DÂN CƯ HIM LAM 6A, HUYỀN BÌNH CHÁNH (Gần đường Dương Bá Trạc quận 8 nối dài)Quyền lợi- Lương tăng theo hiệu quả làm việc- Thưởng nóng- Lương thưởng tháng 13 theo năng lực làm việc- Phụ cấp thâm niên theo tháng & tăng theo thời gian gắn bó với công ty. (Nhân viên làm từ 6 tháng đã được tính thâm nien)- Môi trường làm việc năng động, sáng tạo- Bảo hiểm sức khỏe 24/24* TRAO ĐỔI THÊM KHI PHỎNG VẤNHạn nộp30-07-2017Hình thức nộpBấm ""NỘP HỒ SƠ"" để ứng tuyểnNộp hồ sơ"
"","06-06-2017","","Công Ty CP.Ứng Dụng & Chuyển Giao Công Nghệ Thumbtelling","Nhân Viên Photoshop (Chỉnh Sữa, Phục Hồi Ảnh Cũ) - Bán Thời Gian","Địa chỉ: 90 Thân Nhân Trung, Phường 13, Quận Tân Bình","Kiến trúc/Nội thất, Thiết kế/Mỹ thuật","","","","Bán thời gian","1 năm","Trung cấp","509","","15-06-2017","Mô tảNếu phỏng vấn và test đầu vào thành công công việc chính như sau- Tiếp nhận hình ảnh cũ về nhà làm- Thực hiện công việc chỉnh sửa ảnh cũ trên các phần mềm chuyên dụng: Photoshop...- Xử lý, phục hồi, chỉnh sửa phông nền, cắt...để có hình ảnh đẹp, chất lượngYêu cầu- Ứng viên tốt nghiệp Trung cấp nghề trở lên- Ưu tiên ứng viên có kinh nghiệm làm qua công việc chỉnh sữa ảnh .- Thành thạo photoshop, - Có khiếu mỹ thuật, sáng tạo.- Có tinh thần trách nhiệm công việc.Quyền lợiMôi trường làm việc và quản lý chuyên nghiệp, tạo diều kiện cho ứng viên làm việc tốtHạn nộp15-06-2017Hình thức nộpBấm ""NỘP HỒ SƠ"" để ứng tuyểnNộp hồ sơ"
"","02-06-2017","","CÔNG TY TNHH XÂY DỰNG VÀ CẦU ĐƯỜNG ĐẠI VIỆT","Kiến Trúc Sư Quy Hoạch -Xd","Địa chỉ: 65 - 67 Đường số 11, Khu Trung Sơn, Bình Chánh ( chân Cầu Đỏ Quận 7)","Giao thông/Vận tải/Thủy lợi/Cầu đường, Kiến trúc/Nội thất, Xây dựng","","","","Nhân viên chính thức","Trên 5 năm","Đại học","1,598","","Đã hết hạn","Mô tả-Quản lý hồ sơ thiết kế kiến trúc toàn dự án.-Quản lý hồ sơ chất lượng công trình theo quy định hiện hành.-Giám sát xây dựng hoàn thiện công trình -Lập báo cáo theo định kỳ, báo cáo đột xuất theo yêu cầu-Chi tiết công việc sẽ trao đổi khi phỏng vấn.Yêu cầu-Kinh nghiệm: 5- 10 năm-Chuyên môn: Kiến trúc sư (không phân biệt trường hay hệ đào tạo)-Ưu tiên có Chứng nhận bồi dưỡng nghiệp vụ Giám sát TCXD và QLDAKỹ năng công việc:-Có khả năng thiết kế & quản lý thiết kế-Có thực tế tại công trường xây dựng-Am hiểu về thành phần hồ sơ chất lượng-Có kn thực tế về xây dựng các khu chợ buôn bán- Có Kn quy hoạch dự án khu dân cưQuyền lợi- Thưởng theo Quy định, Quyết định của Công ty & Ban giám đốc- Chế độ BHXH, BHYT, BHTN và bảo hiểm tai nạn 24/24- Đảm bảo đầy đủ các quyền lợi & nghĩa vụ của người lao động theo Bộ luật lao độngHạn nộpĐã hết hạnHình thức nộpBấm ""NỘP HỒ SƠ"" để ứng tuyểnNộp hồ sơ"
