"ad_id","post_date","phone","company","subject","location","category","position","platform","type","level","experience","education","view","applied","expired_date","body"
"","07-06-2017","","CÔNG TY CỔ PHẦN SÀI GÒN XANH","Nhân Viên Giám Sát Thi Công","Địa chỉ: 193/25, Nam Kỳ Khởi Nghĩa, p.7, q.3, Tp.HCM","Kiến trúc/Nội thất, Quản lý điều hành, Xây dựng","","","","Nhân viên chính thức","2 năm","Đại học","1,219","","30-06-2017","Mô tả1. Hỗ trợ Quản lý Dự án giai đoạn 2 ( PM2 ) trong giai đoạn chuẩn bị.2. Nộp bản vẽ xin phép cho tòa nhà, chuẩn bị hồ sơ khởi công: danh sách công nhân, nội qui công trường, an toàn lao động ( ATLĐ ), biểu mẫu của Tòa nhà.3. Lập bảng dự trù máy móc, thiết bị, dụng cụ thi công trình PM2 duyệt. Chịu trách nhiệm thực hiện công việc điều động giao nhận vận chuyển.4. Hướng dẫn và giám sát công nhân, thầu phụ thực hiện đúng nội quy công trường, ATLĐ.5. Tạm ứng chi phí theo bảng tổng dự trù kinh phí do PM2 lập. Liệt kê chi phí hàng ngày, hóa đơn chứng từ, giải chi hàng tuần. Báo cáo thu chi công trường hàng ngày.6. Ghi chép nhật ký công trường: phân công công việc các nhà thầu, tổ, nhóm thi công, khối lượng thực hiện, tiến độ thực tế, tóm tắt tình hình thi công.7. Sắp xếp, lưu trữ hồ sơ, bản vẽ, các biên bản họp, thông báo, v.v…8. Tham gia và nắm rõ buổi họp triển khai, tổ chức công việc cho thầu phụ, công nhân do PM2 chủ trì.9. Giám sát những công việc mà PM2 triển khai.10. Trực tiếp chấm công và báo cáo công nhân công trường hàng ngày cho Quản lý Đội thi công, phòng hành chánh. 11. Tiếp nhận yêu cầu phát sinh của khách hàng tại công trường thông báo PM2 quyết định.12. Mua vật tư linh tinh phát sinh trong quá trình thi công. Lưu ý: những vật tư chính số lượng lớn, giá trị lớn ngay khi lập dự trù chuẩn bị khởi công phải chuyển ngay cho nhân viên vật tư (anh Sáu Nhàn) cung ứng với đầy đủ thông tin: chủng loại, qui cách, số lượng, thời gian, địa điểm và người nhận.13. Quản lý toàn bộ tài sản của công ty đem vào công trường: máy móc, thiết bị, dụng cụ thi công, bàn ghế làm việc, áo đồng phục, v.v… và có trách nhiệm báo cáo lại PM2 sau khi hoàn tất.14. Làm các thủ tục nghiệm thu các bên. Cùng với các nhà cung cấp thực hiện việc đo đếm số liệu thực tế tại công trường. Kiểm ký xác nhận số lượng hàng từ nhà máy giao.15. Sau khi kết thúc công trình:-Tập hợp hồ sơ công trường, chuyển về nhân viên kinh doanh lưu trữ.- Phân loại vật tư, máy móc thiết bị dụng cụ. Vật tư dư chuyển về kho nhà máy . Máy móc thiết bị chuyển về văn phòng. - Tất cả các việc trên đều phải có biên bản giao nhận.- Tuyệt đối không được chuyển rác xà bần về nhà máy, công trường tự xử lý.16. Cập nhật hồ sơ gốcvà cập nhật các phát sinh thay đổi tại công trường, sau khi kết thúc công trình chuyển về phòng thiết kế thực hiện hoàn công.Yêu cầu- Kinh Nghiệm giám sát trong lĩnh vực nội thất.Quyền lợi- Được làm việc trong môi trường chuyên nghiệp và năng động - Được tham gia BHXH, BHYT và các chế độ phúc lợi khác của Công ty - Tăng lương định kỳ hàng năm tùy theo năng lực làm việc - Được thưởng các ngày lễ, tết theo quy định của Công ty - Các chế độ chính sách khác được thực hiện đầy đủ theo quy định của LLĐ và quy định của Công ty - Có cơ hội thăng tiếnHạn nộp30-06-2017Hình thức nộpBấm ""NỘP HỒ SƠ"" để ứng tuyểnNộp hồ sơ"
"","03-06-2017","","TNHH TA DESIGN","Thiết Kế 3D","Địa chỉ: Số 40, Lô C14B, Khu phố Star Hill, Đường C, Phường Tân Phú, Quận 07.","Kiến trúc/Nội thất, Thiết kế/Mỹ thuật, Xây dựng","","","","Nhân viên chính thức","2 năm","Cao đẳng","114","","15-06-2017","Mô tả-Khảo sát, đo vẽ hiện trạng công trình, hiện trang không gian nội thất-Đề xuất ý tưởng phù hợp và độc đáo cho từng yêu cầu thiết kế;-Thiết kế ý tưởng và triển khai bản vẽ kiến trúc, nội thất ( Lên mặt bằng, bố trí, triển khai phối cảnh)-Nghiên cứu giải pháp, tư vấn cho KH về yêu cầu thiết kế và công năng cho không gian nội thất-Triển khai bản vẽ thi công;-Phác thảo không gian mẫuvà dựng 3D, phối cảnh nội – ngoại thất.-Dựng phối cảnh 3D, hoặc triển khai hồ sơ kỹ thuât 2D theo yêu cầu thiết kế nội thất của trưởng phòng.Yêu cầu> 2 năm kinh nghiệm, thành thạo vẽ 3DĐọc hiểu tài liệu chuyên môn, ưu tiên giao tiếp bằng tiếng AnhBiết sử dụng các phần mềm thiết kế,...Quyền lợi- Được nghỉ chiều thứ 7 và chủ nhật hàng tuần - Môi trường làm việc thân thiện, năng động - Được tham gia BHXH, BHYT, BHTN đầy đủ và các quyền lợi theo quy định của pháp luật. - Tham gia các kỳ nghỉ mát, team building do công ty tổ chức - Định kỳ hàng năm được xét nâng lương 1 lần. - Có hồ bơi và phòng gym ở công ty (hỗ trợ nhân viên)Hạn nộp15-06-2017Hình thức nộpBấm ""NỘP HỒ SƠ"" để ứng tuyểnNộp hồ sơ"
"","06-06-2017","","Công Ty TNHH Chế Biến Thực Phẩm Việt Ấn","Nhân Viên Kế Toán Nội Bộ Làm Việc Tại Q.7","Địa chỉ: 844 Quốc lộ 1A - Bình Trị Đông A - Bình Tân - Hồ Chí Minh","Tài chính/Kế toán/Kiểm toán","","","","Nhân viên chính thức","2 năm","Đại học","4,485","","10-06-2017","Mô tả- Thực hiện công việc kiểm soát chi phí, phân tích tỷ lệ, tính hiệu quả của chi phí.- Phân tích hiệu quả của từng thị trường, từng khách hàng, từng mặt hàng.- Kiểm soát chi phí phòng ban.- Phân tích số liệu kế toán, tài chính để phục vụ làm báo cáo quản trị.- Đưa ra các ý kiến cảnh báo, đề xuất cải tiến trong hoạt động quản lý SXKD và tài chính của công ty.- Lập báo cáo quản trị theo yêu cầu.- Trao đổi thêm khi phỏng vấn.Yêu cầu- Giỏi về Excel Pivot Table, Graphs, Powerpoint- Đã có kinh nghiệm làm báo cáo cho BGĐ & HĐQT.- Ưu tiên ứng viên biết sử dụng SQL. Không cần biết kế toán thuế- Làm việc tại VP Trung Sơn, Bình ChánhQuyền lợi- Thu nhập từ 6tr trở lên.- Có thưởng quý, năm theo kết quả công việc.- Các chế độ BHXH đầy đủ.- Các phúc lợi khác của công ty: phép, phụ cấp...- Phụ cấp cơm trưa.Hạn nộp10-06-2017Hình thức nộpBấm ""NỘP HỒ SƠ"" để ứng tuyểnNộp hồ sơ"
"","24-05-2017","","Công ty TNHH SX TM-DV & XD VAV","Nhân Viên Thiết Kế Nội Thất","Địa chỉ: D06 Khu Nhà ở Galleria Nam Sài Gòn, 18A Nguyễn Hữu Thọ, Xã Phước Kiển, Huyện Nhà Bè","Kiến trúc/Nội thất, Kinh doanh, Thiết kế/Mỹ thuật","","","","Nhân viên chính thức","1 năm","Cao đẳng","618","","30-06-2017","Mô tảThiết kế mặt bằng (Layout - 2d), phân khu chức năng, công năng Tìm hình ảnh minh họa, lên concept ý tưởng thiết kế Thiết kế 3D theo layout + concept đã thống nhất với khách hàng.Yêu cầuSinh năm 1991-1994  Khả năng thiết kế và diễn họa tốt bằng 3ds Max. Trên 1 năm kinh nghiệm về thiết kế nội thất. Tốt nghiệp Cao đẳng/ Đại Học chuyên ngành. Làm việc theo nhóm tốt và ham học hỏi Chịu được áp lực công việc.Quyền lợi  Mức lương 7-10 triệu + thưởng theo dự án (sẽ hiểu rõ khi phỏng vấn). Có cơ hội thăng tiến. Tiếp xúc với nhiều vật liệu và phương thức thi công mới. Xét tăng lương phù hợp với sự nỗ lực, đóng góp cho sự phát triển công ty. Được tham gia đầy đủ BHXH, BHYT và các chế độ phúc lợi khác theo đúng quy định của luật Lao động và quy chế công ty.Hạn nộp30-06-2017Hình thức nộpBấm ""NỘP HỒ SƠ"" để ứng tuyểnNộp hồ sơ"
"","04-06-2017","","CÔNG TY THIẾT KẾ XÂY DỰNG BẢO SƠN","Kiến Trúc Sư","Địa chỉ: 2/77 Phan Thúc Duyện, Phường 4, Quận Tân Bình, TP. Hồ Chí Minh","Kiến trúc/Nội thất","","","","Nhân viên chính thức","2 năm","Đại học","301","","10-06-2017","Mô tả- Thực hiện thiết kế kiến trúc, thiết kế 3D công trình dân dụng.- Thực hiện các công việc khác theo yêu cầu của công ty.Yêu cầu- Tốt nghiệp đại học chính quy chuyên về kiến trúc.- Có kinh nghiệm- Khả năng lên phương án ý tưởng thiết kế 3D nội - ngoại thất tốt.- Sử dụng thành thạo Sketup, 3Dmax, Photoshop.- Tinh thần trách nhiệm, tập trung cao và có khả năng làm việc độc lập.Quyền lợi- Được hưởng các chế độ theo luật lao động- Chế độ lương thưởng theo chính sách hiện hành của công ty- Được làm trong môi trường chuyên nghiệp, có cơ hội phát triểnHạn nộp10-06-2017Hình thức nộpBấm ""NỘP HỒ SƠ"" để ứng tuyểnNộp hồ sơ"
"","07-06-2017","","Công ty cổ phần TDD Việt Nam","Nhân Viên Kỹ Thuật Sơn Nước (Thợ Sơn)","Địa chỉ: 506 lê văn khương, Phường Thới An, Quận 12, HCM","Bất động sản, Kiến trúc/Nội thất, Xây dựng","","","","Nhân viên chính thức","1 năm","Không yêu cầu","1,313","","20-06-2017","Mô tả1Giám sát thi công Sơn nước tại công trình, dự án 2.Làm mẫu các loại sơn tại công trình, dự án3.Xử lý sự cố kỹ thuật sản phẩm Công ty 4.Tham mưu, tư vấn đề xuất cải tiến nâng cao chất lượng sản phẩm.5.Hỗ trợ kỹ thuật cho bộ phận kinh doanh và khách hàng khi có yêu cầu. 6.Giải đáp cho khách hàng các vấn đề kỹ thuật liên quan tới sử dụng sơn.7. Chi tiết công việc sẽ được trao đổi cụ thể khi phỏng vấn.Yêu cầu-Trình độ tốt nghiệp từ PTTH trở lên -Kinh nghiệm giám sát hoặc thi công trực tiếp các công trình xây dựng cơ sở hạ tầng, các dự án xây dựng. Có kiến thức về sản phẩm Sơn của Công ty là một lợi thếQuyền lợi-Lương theo thỏa thuận -Chế độ thưởng, phụ cấp, phúc lợi theo quy định Công ty-Chế độ BHXH - BHYT - BHTN theo quy định Nhà nước -Môi trường làm việc năng động, chuyên nghiệp và cơ hội phát triểnHạn nộp20-06-2017Hình thức nộpBấm ""NỘP HỒ SƠ"" để ứng tuyểnNộp hồ sơ"
"","02-06-2017","","Var.Design","Kiến Trúc Sư Công Trình","Địa chỉ: Số 2 Thi Sách, Phường Đa Kao, Quận 1 TP Hồ Chí Minh","Kiến trúc/Nội thất","","","","Nhân viên chính thức","1 năm","Đại học","23","","30-06-2017","Mô tả- Thiết kế phương án , triển khai ý tưởng thiết kế, dựng phối cảnh 3D.- Quản lý bản vẽ thi công dự án.- Quản lý và giám sát các công việc thi công cảnh quan ngoài hiện trường theo thiết kế- Công việc trao đổi cụ thể khi phỏng vấnYêu cầu- Tốt nghiệp ĐH chuyên ngành kiến trúc. - Có kinh nghiệm thiết kế các công trình cao tầng, triển khai chi tiết, thể hiện phối cảnh tốt.- Thành thạo các phần mềm chuyên ngành: Autocad – 3Dmax – Photoshop, Sketch up …- Năng động, có chí cầu tiến.Quyền lợi- Có kinh nghiệm là 1 lợi thế- Lương thỏa thuận- Các chế độ phúc lợi khác theo quy định của Công ty; chế độ nghỉ phép năm - Được làm việc trong môi trường trẻ, năng động, nhiệt huyết, đam mê công việc và cùng nhau tạo dựng giá trị cho doanh nghiệp - Được đào tạo, nâng cao về chuyên môn, kỹ năng nghiệp vụ và các kỹ năng mềm khácHạn nộp30-06-2017Hình thức nộpBấm ""NỘP HỒ SƠ"" để ứng tuyểnNộp hồ sơ"
"","05-06-2017","","CÔNG TY PHƯỚC SƠN","Nhân Viên Kinh Doanh","Địa chỉ: 335 Bình Quới, Phường 28, quận Bình Thạnh","Kiến trúc/Nội thất, Kinh doanh, Quảng cáo/Marketing/PR","","","","Nhân viên chính thức","Chưa có kinh nghiệm","Đại học","135","","10-06-2017","Mô tảTìm hiểu thị trường ngành quảng cáo, trang trí nội thất.Làm hồ sơ thầuLàm hợp đồng Kinh tế, phụ lục hợp đồngLàm bảng báo giá cho khách hàngLàm biên bản nghiệm thu, thanh lý hợp đồngLàm lệnh sản xuất gửi Xưởng thi côngYêu cầuTốt nghiệp Cao đẳng/Đại học chuyên ngành kinh tế, QTKD, thiết kế nội thất.Ưu tiên sinh viên vừa ra trường, hoạt động sôi nổi trong các hoạt động Đoàn, Độiở trường.Tiếng Anh : bằng B trở lên.Kỹ năng ngoại giao, khai thác và chinh phục khách hàng tốt.Kỹ năng đàm phán và thuyết phục tốt.Kỹ năng lập hợp đồng kinh tế, soạn thảo văn bản tốt.Ưu tiên có kinh nghiệm trong ngành quảng cáo bảng biển ngoài trời và nội thất showroom.Quyền lợi- Được đào tạo chuyên môn hoặc quản lý .- Được tham gia các chế độ bảo hiểmTham quan nghỉ mát hàng năm- Lương thỏa thuận theo năng lực- Lương cơ bản từ 5tr-7tr- Phụ cấp tiền xăng xe, tăng ca hằng tháng- Hoa hồng cuối năm theo doanh thu công tyHạn nộp10-06-2017Hình thức nộpBấm ""NỘP HỒ SƠ"" để ứng tuyểnNộp hồ sơ"
"","07-06-2017","","CÔNG TY TNHH SẢN XUẤT KINH DOANH HAI THÀNH","Họa Viên 3D","Địa chỉ: 79C Đông Hồ, P8, Tân Bình","Bất động sản, Kiến trúc/Nội thất, Thiết kế/Mỹ thuật","","","","Nhân viên chính thức","1 năm","Trung cấp","616","","30-06-2017","Mô tả- Sử dụng thành thạo phần mềm AutoCad2D, Photoshop, Sketchup,3Ds Max -Ưu tiên ứng viên biết triển khai hồ sơ trên revit.- Biết triển khai bản vẽ thiết kế kiến trúc công trình dân dụng và công nghiệp (Kiến trúc công trình và tổng thể).- Biết cấu tạo kiến trúc.Yêu cầu- Kinh nghiệm từ 6 tháng trở lên.- Sử dụng được các phần mềm cần thiết cho công việc.- Tốt nghiệp các chuyên ngành liên quan.Quyền lợi- Lương + thưởng + phụ cấp - Các chế độ theo luật lao động: BHXH, BHYT, BHTN đầy đủ- Thưởng các ngày Lễ Tết và du lịch trong năm tùy theo tình hình hoạt động của Công Ty.- Các chế độ phúc lợi khác như: Nghỉ lễ, tết, phép năm…Hạn nộp30-06-2017Hình thức nộpBấm ""NỘP HỒ SƠ"" để ứng tuyểnNộp hồ sơ"
"","02-06-2017","","Tập đoàn C.T Group Việt Nam","Họa Viên Thiết Kế","Địa chỉ: 60A, Trường Sơn, P. 2, Q. Tân Bình, TP. HCM","Bất động sản, Kiến trúc/Nội thất, Xây dựng","","","","Nhân viên chính thức","1 năm","Đại học","43","","01-07-2017","Mô tả- Tham gia triển khai thiết kế kỹ thuật dự án chung cư.- Hỗ trợ kiến trúc sư khai triển chi tiết hồ sơ thiết kế kỹ thuật.- Triển khai bản vẽ kỹ thuật thi công nội, ngoại thất các công trình.- Triển khai các bản vẽ hoàn công.- Các công việc khác theo sự phân công công việc của Kiến trúc sư.Yêu cầu- Thành thạo autocad 2D- Có kinh nghiệm vẽ shopdraw- Hiểu về xây dựng- Tốt nghiệp trung cấp hoặc tương đương trở lên.Quyền lợi- Thưởng lương tháng 13, thưởng thành tích, thưởng cổ phiếu hàng năm.- Được tham gia BHXH, BHYT, BHTN đầy đủ. Đồng thời, còn được hưởng chính sách hỗ trợ khám sức khỏe đặc biệt tại các Phòng khám của các Bác sỹ giỏi ở nhiều chuyên khoa khác nhau mà Tập Đoàn đã hợp tác.- Nghỉ dưỡng cùng với gia đình tại các khu resort của Tập Đoàn 2 lần/năm.- Vé xem phim tại CGV-Phiếu mua hàng giảm giá tại các cửa hàng thời trang cao cấp, các nhà sang trọng của Tập Đoàn.- Thưởng tiền mặt & vouchervào các dịp Lễ lớn…- Nghỉ mát hàng nămHạn nộp01-07-2017Hình thức nộpBấm ""NỘP HỒ SƠ"" để ứng tuyểnNộp hồ sơ"
"","02-06-2017","","Công ty TNHH Finesun Construction","Kĩ Sư Dự Toán","Địa chỉ: Số 21, đường số 5 khu dân cư Trung Sơn, xã Bình Hưng, Huyện Bình Chánh, Hồ Chí Minh","Kiến trúc/Nội thất, Thiết kế/Mỹ thuật, Xây dựng","","","","Nhân viên chính thức","2 năm","Đại học","68","","30-06-2017","Mô tả• Bóc tách, kiểm tra khối lượng đấu thầu và các công việc liên quan.• Chuẩn bị hồ sơ thanh toán với chủ đầu tư, tư vấn.• Tính toán khối lượng và đo bóc khối lượng công trình.• Quản lý hợp đồng, các điều khoản thanh toán.• Phụ trách hồ sơ hoàn công, thanh quyết toán công trình.• Xác định định mức, đơn giá xây dựng công trình, chỉ số giá xây dựng.• Tính toán lại chi phí nếu có sự thay đổi trong thiết kế hoặc thay đổi biện pháp thi công.• Quản lý, kiểm soát hồ sơ dự toán trong từng giai đoạn thực hiện dự án.Yêu cầu• Tốt nghiệp Đại học trở lên• Chuyên ngành Xây dựng, Kinh tế xây dựng• Thành thạo lập dự toán trên excel, nắm rõ giá vật tư, giá giao thầu các công trình.• Kĩ năng đọc bản vẽ tốt, tính toán nhanh nhạy.• Tối thiểu có 1 năm kinh nghiệm làm việc trong lĩnh vực dự toán• Ưu tiên ứng viên sử dụng tiếng anh giao tiếp.Quyền lợi• Được làm việc trong môi trường năng động, có cơ hội thăng tiến cao.• Chế độ BHXH,BHYT, nghỉ phép năm và các chế độ phúc lợi khác.• Mức lương: Thảo thuận dựa theo năng lực.Hạn nộp30-06-2017Hình thức nộpBấm ""NỘP HỒ SƠ"" để ứng tuyểnNộp hồ sơ"
"","06-06-2017","","Công ty TNHH TM-XD Hưng Thịnh","Nhân Viên Kinh Doanh Nội Thất","Địa chỉ: 470 Điện Biên Phủ, Phường 17, Quận Bình Thạnh, TP HCM","Kiến trúc/Nội thất, Kinh doanh, Xây dựng","","","","Nhân viên chính thức","1 năm","Trung cấp","349","","30-06-2017","Mô tả- Nhân viên kinh doanh cửa nhựa upvc, sàn gỗ- Đem mẫu cho khách hàng xem, giới thiệu với khánh hàng về sản phẩm của công ty- Ký kết hợp đồng, nghiệm thu công trình - Cùng bàn bạc với Trưởng phòng để thống nhất phương án kinh doanh có hiệu quả- Cuối tháng sẽ được tính thưởng doanh số ngoài tiền lương cố định.- Địa chỉ công ty : 470 Điện Biên Phủ, P.17, Q. Bình Thạnh, TPHCMYêu cầu- Siêng năng, nhanh nhẹn- Ưu tiên người đã từng làm nvkd các sản phẩm nội thất- Trình độ trung cấp trở lênQuyền lợi- Lương cơ bản 5,000,000Đ/tháng + % hoa hồng- Mức thu nhập từ 5,000,000Đ - 15,000,000Đ/tháng (tùy theo năng lực)- Trao đổi chi tiết khi phỏng vấn- Làm việc trong môi trường năng động, sáng tạo, chuyên nghiệp & nhiều thách thức.- Được hưởng các chế độ đãi ngộ và phúc lợi xã hội theo đúng Luật Lao động.Hạn nộp30-06-2017Hình thức nộpBấm ""NỘP HỒ SƠ"" để ứng tuyểnNộp hồ sơ"
"","07-06-2017","","CÔNG TY CỔ PHẦN SÀI GÒN XANH","Nhân Viên Dự Toán","Địa chỉ: 193/25, Nam Kỳ Khởi Nghĩa, p.7, q.3, Tp.HCM","Kiến trúc/Nội thất, Tài chính/Kế toán/Kiểm toán, Xây dựng","","","","Nhân viên chính thức","2 năm","Cao đẳng","948","","30-06-2017","Mô tả- Kiểm tra lại khối lượng các hạng mục thi công so với Hồ sơ bản vẽ do phòng thiết kế triển khai (Trường hợp hồ sơ thông qua Phòng Thiết kế)Tính khối lượng & hạng mục thi công dựa theo hsơ thiết kế có sẵn (Trường hợp Hồ sơ đơn vị khác thiết kế)- Kiểm tra và cập nhật thông tin về tất cả đơn giá vật tư, giá thầu phụ, nhà cung cấp.- Lập bảng tính chi tiết và báo giá.- Phân tích và lập định mức đơn giá nội thất.- Lập bảng quyết toán với khách hàng. (Theo khối lượng nghiệm thu có chữ ký của khách hàng)- Thực hiện các nhiệm vụ khác theo sự phân công của trưởng phòng Đấu thầu.- Báo cáo hàng tuần về tình hình thực hiện công việc trong tuần (Các công việc đã giải quyết, Kế hoạch thực hiện tuần kế tiếp, những khó khăn gặp phải và đề xuất hướng giải quyết)- Báo cáo đột xuấtYêu cầu- Tốt nghiệp Cao Đẳng Đại học chuyên ngành liên quan- Có ít nhất 2 năm kinh nghiệp ở vị trí tương đương- Chịu áp lực công việc cao, giao tiếp tốt- Nhanh nhẹn và hoà đồng- Anh văn giao tiếpQuyền lợi- Được làm việc trong môi trường chuyên nghiệp và năng động - Được tham gia BHXH, BHYT và các chế độ phúc lợi khác của Công ty - Tăng lương định kỳ hàng năm tùy theo năng lực làm việc - Được thưởng các ngày lễ, tết theo quy định của Công ty - Các chế độ chính sách khác được thực hiện đầy đủ theo quy định của LLĐ và quy định của Công ty - Có cơ hội thăng tiếnHạn nộp30-06-2017Hình thức nộpBấm ""NỘP HỒ SƠ"" để ứng tuyểnNộp hồ sơ"
"","07-06-2017","","CÔNG TY CỔ PHẦN ĐẦU TƯ QUỐC CƯỜNG LAND","Nhân Viên Kinh Doanh Bất Động Sản","Địa chỉ: 82-82A-82B-82C Võ Văn Tần, Phường 6, Quận 3, Thành phố Hồ Chí Minh","Kiến trúc/Nội thất, Kinh doanh, Sinh viên/Mới tốt nghiệp/Thực tập","","","","Nhân viên chính thức","Chưa có kinh nghiệm","Đại học","944","","31-08-2017","Mô tả- Tìm kiếm khách hàng tiềm năng. - Tiếp thị và tư vấn thông tin về sản phẩm, dự án cho khách hàng- Trực tiếp thực hiện các nghiệp vụ kinh doanh: đàm phán, thương lượng với khách hàng- Quản lý thông tin khách hàng, chăm sóc khách hàng cũ.Yêu cầu- Tốt nghiệp trung cấp trở lên các chuyên ngành có liên quan.- Năng động, đam mê.- Giao tiếp, đàm phám, thuyết phục tốt.- Có laptop- Không cần kinh nghiệm ngành BĐS nhưng có tố chất và mong muốn phát triển nghề nghiệp lĩnh vực BĐS, sẽ được công ty đào tạoQuyền lợi- Lương cơ bản cao + phụ cấp + 1% tống giá trị sản phẩm- Các chế độ BHYT, BHXH, BHTN theo quy định.- Được làm việc trong môi trường chuyên nghiệp, năng động, hỗ trợ, chia sẽ. Cơ hội thăng tiến cao.- Tham gia các hoạt động du lich, sinh nhật, …Hạn nộp31-08-2017Hình thức nộpBấm ""NỘP HỒ SƠ"" để ứng tuyểnNộp hồ sơ"
"","07-06-2017","","CTY TNHH SX TM DV XNK THỜI TRANG SAO KIM","Chuyên Viên Thiết Kế Nội Thất","Địa chỉ: 123, Lê Thị Hồng Gấm, P. Cầu Ông Lãnh, Q1","Kiến trúc/Nội thất, Nghệ thuật/Điện ảnh, Thiết kế/Mỹ thuật","","","","Nhân viên chính thức","1 năm","Không yêu cầu","174","","10-06-2017","Mô tảDựng mô hình phòng , sắp xếp nội thất bằng sketchup lumionYêu cầuThành thạo sketchup lumionQuyền lợiCó cơ hội thăng tiếnLàm việc trongmôi trường năng độngTăng lương theo năng lựcHạn nộp10-06-2017Hình thức nộpBấm ""NỘP HỒ SƠ"" để ứng tuyểnNộp hồ sơ"
