"ad_id","post_date","phone","company","subject","location","category","position","platform","type","level","experience","education","view","applied","expired_date","body"
"","06-06-2017","","CÔNG TY TNHH TUẤN LỘC","Nhân Viên Thiết Kế","Địa chỉ: Xã: Tân An - H: Vĩnh Cửu - T. Đồng Nai","Công nghệ thông tin, Kiến trúc/Nội thất, Thiết kế/Mỹ thuật","","","","Nhân viên chính thức","2 năm","Trung cấp","2,050","","16-06-2017","Mô tảThiết kế sản phẩm ngành gổ nội thất ,xuất khẩu theo đơn hàng.Chi tiết công việc sẽ trao đổi trong buổi phỏng vấn.Yêu cầuTốt nghiệp từ cao đẳng trở lên chuyên ngành: Thiết kế Kỹ thuật, thiết kế mỹ thuật, đồ họa.Ưu tiên các ứng viên đã từng làm thiết kế nội thất.Thành thạo vi tính văn phòng, 2D, 3D, 3D Max.Quyền lợiTheo quy định của Pháp luật Lao động hiện hành.Các chính sách đãi ngộ khác của công ty như:- Tổ chức sinh nhật cho CBCNV hàng tháng.- Tổ chức đi du lịch, nghỉ mát hàng năm.- Tổ chức các hoạt động sinh hoạt văn hóa, văn nghệ, thể thao, các cuộc thi nhằm gắn kết mọi người và nâng cao nhận thức, tư duy.- Văn hóa công ty theo quan điểm hiện đại: CBCNV là khách hàng của nhau trong hành xử công việc và cuộc sống. CBCNV là tài sản lớn của công ty, không theo kiểu ""vắt chanh bỏ vỏ"" mà theo quan điểm của Người Nhật: ""Sử dụng người suốt đời"".- Chính sách đãi ngộ đặc biệt cho quản lý cấp Trung cao.- Môi trường làm việc: công bằng, minh bạch, công khai; định lượng chứ không định tính, Xứng đáng để CBCNV làm việc.- Được hỗ trợ tối đa từ Ban TGĐ và các phòng ban.Hạn nộp16-06-2017Hình thức nộpBấm ""NỘP HỒ SƠ"" để ứng tuyểnNộp hồ sơ"
"","02-06-2017","","LIEN NGO","Kiến Trúc / Nội Thất,","Địa chỉ: 565 A National Road 13, Hiep Binh Phuoc Ward, Thu Duc Dist, Ho Chi Minh City, Viet Nam","Kiến trúc/Nội thất, Nông/Lâm/Ngư nghiệp","","","","Nhân viên chính thức","2 năm","Đại học","26","","10-06-2017","Mô tả-Vẽ thiết kế nội thất,Yêu cầuCó 2 năm kinh nghiêmKhả năng giao tiêp tốtTiếng Anh thành thạo Biết sử dụng phần mềm phtoshop, Auto CADQuyền lợiMÔi trường làm việc độc lập, năng đông, có cơ hội được đào tạo và thăng tiênHạn nộp10-06-2017Hình thức nộpBấm ""NỘP HỒ SƠ"" để ứng tuyểnNộp hồ sơ"
"","02-06-2017","","Công ty TNHH MTV Kiến Trúc, Xay Dựng Phạm Phú và Cộng Sự","Nhân Viên Thiết Kế Nội Thất","Địa chỉ: 46/3 Lê Thánh Tôn - Phường Lộc Thọ - Nha Trang","Kiến trúc/Nội thất","","","","Nhân viên chính thức","Chưa có kinh nghiệm","Đại học","27","","30-06-2017","Mô tảThiết kế nội thất :1. Thiết kế tìm ý và lên phương án ý tưởng nội thất2. Tham khảo, khảo sát không gian hiện trạng công trình3. Tham gia tư vấn, giải trình ý tưởng thiết kế với đối tác, khách hàng khi được phân công4. Thực hiện công việc thiết kế và đảm bảo theo đúng tiến độ yêu cầuYêu cầu– Tốt nghiệp chuyên ngành kiến trúc, thiết kế nội thất– Có khả năng làm việc độc lập (nếu cần)– Có kỹ năng làm việc theo nhóm.– Thành thạo các kĩ năng đồ họa: autocard, sketchup, 3D max, phottoshop- Ưu tiên các kiến trúc sư trẻ (có thể mới ra trường) có tinh thần có tinh thần ham học hỏi và nhiệt huyết.Quyền lợi-Tiền thưởng lễ tết: Được hưởng theo quy chế lương thưởng chung của toàn công ty-Hình thức trả lương: Theo thời gian-Được trả lương vào ngày cuối tháng-Bảo hiểm xã hội, bảo hiểm y tế, bảo hiểm thất nghiệp: Được tham gia bảo hiểm theo quy đinh của Luật bảo hiểm về mức tham gia đóng và tỷ lệ đóng.-Các khoản bổ sung, phúc lợi khác: Hàng năm người lao động được đi tham quan, du lịch, nghỉ mát, quà sinh nhật theo quy định của công tyHạn nộp30-06-2017Hình thức nộpBấm ""NỘP HỒ SƠ"" để ứng tuyểnNộp hồ sơ"
"","05-06-2017","","Công ty TNHH Thiết - Kế Trang Trí Nội Thất Lê Vin","Nhân Viên Giám Sát Công Trình","Địa chỉ: 127 Nguyễn Minh Hoàng Phường 12 , Quận Tân Bình","Kiến trúc/Nội thất, Quản lý điều hành, Xây dựng","","","","Nhân viên chính thức","2 năm","Cao đẳng","1,855","","30-06-2017","Mô tả-Giám sát thợ thi công trang trí nội thất tại công trình trong các cao ốc tòa nhà . -Liên hệ với ban quản lý tòa nhà để đăng ký danh sách cho thợ thi công , lập tiến độ theo dõi sát trong quá trình thi công trang trí nội thất để báo cáo về công ty và chủ đầu tư biết mức độ công việc hoàn thành .Kiểm tra chất lượng thi công tại công trình. -.Điều phối các nhóm thợ thi công đúng tiến độ đề raYêu cầu-Nam có sức khỏe và ngoại hình tốt ,tốt nghiệp đại học hoặc cao đẳng ngành xây dựng hoặc trang trí nội thất .-Có kinh nghiệm giám sát tốt ,am hiểu về vật liệu nội thất.-Chịu khó làm việc và có tinh thần trách nhiệm trong công việcQuyền lợi-Ngoài mức lương căn bản còn có phụ cấp hàng tháng ,đảm bảo thu nhập cao -Môi trường làm việc rất thoải mái , trẻ trung năng động và thân thiện , rất nhiệt huyết cho những bạn có tinh thần cầu tiến cao -Ngoài ra còn hưởng các chế độ ưu đãi như tất cả các công ty khác và cuối năm sẽ thưởng lương tháng 13 nếu làm được 1 năm trở lên .Hạn nộp30-06-2017Hình thức nộpBấm ""NỘP HỒ SƠ"" để ứng tuyểnNộp hồ sơ"
"","06-06-2017","","Mitssy (Ahometo)","Nghệ Sĩ Diễn Họa 3D","Địa chỉ: 294 Nguyễn Trọng Tuyển Phường 1 Tân Bình","Kiến trúc/Nội thất, Thiết kế/Mỹ thuật, Xây dựng","","","","Nhân viên chính thức","1 năm","Chứng chỉ","135","","15-06-2017","Mô tả•Diễn họa 3D cho các thiết kế nội thất•Tư vấn thiết kế nội thất cho KH•Hỗ trợ các phòng ban khác về mặt chuyên mônThời gian làm việc:•Thứ 2 – Thứ 6: 8g30 đến 5g30•Thứ 7: 8g30 – 12gYêu cầu•Bắt buộc sử dụng thành thạo các phần mềm thiết kế:Sketch up, Auto Cad, 3Dmax•Biết sử dụng Photoshop, Illustrator…là một lợi thế•Có tinh thần cầu tiến, đam mê nhiệt tình công việc•Ít nhất có 1 năm kinh nghiệm dựng hình 3D•Khả năng giao tiếp tốtQuyền lợi•Thu nhập: lương cơ bản tùy kinh nghiệm + thưởng dự án•Tham gia đầy đủ BHXH theo quy định nhà nước•Môi trường làm việc trẻ trung, nhiều cơ hội phát triển bản thânHạn nộp15-06-2017Hình thức nộpBấm ""NỘP HỒ SƠ"" để ứng tuyểnNộp hồ sơ"
"","07-06-2017","","Cty CP SX TM XNK Viễn Thông A","Giám Sát Xây Dựng Miền Trung (Làm Việc Tại Đà Nẵng)","Địa chỉ: 330, Đường 3/2, Q.10, Tp.Hcm","Kiến trúc/Nội thất, Xây dựng","","","","Nhân viên chính thức","2 năm","Đại học","242","","30-06-2017","Mô tả- Khảo sát mặt bằng New Store, Renew khu vực miền Trung;- Tiếp nhận thông tin, tổng hợp và thống nhất các hạng mục công trình tại Miền Trung;- Giám sát, theo dõi tiến độ và chất lượng công trình xây dựng khu vực miền Trung;- Nghiệm thu các công trình xây dựng khu vực miền Trung;- Kiểm tra khối lượng và đơn giá thanh quyết toán các hạng mục xây dựng newsin và renew;- Thực hiện các công tác chuyên môn có liên quan để phối hợp và hỗ trợ các phòng, ban;- Chịu sự phân công trực tiếp các công việc chuyên môn khác từ Trưởng phòng Xây dựng.* Địa điểm làm việc: TP Đà Nẵng và sẵn sàng đi công tác các tỉnh Miền Trung.Yêu cầu- Nam, tuổi từ 27 - 33;- Tốt nghiệp Đại học chuyên ngành Xây dựng dân dụng & công nghiệp;- Có kinh nghiệm giám sát công trình ít nhất từ 2 năm trở lên, ưu tiên có kinh nghiệm giám sát xây dựng chuỗi các cửa hàng;- Chịu áp lực cường độ làm việc cao;- Sử dụng thành thạo các phần mềm kĩ thuật và đồ họa trong ngành xây dựng;- Sẵn sàng đi công tác thường xuyên.Quyền lợi- Mức lương thưởng, chế độ đãi ngỗ hấp dẫn;- Môi trường làm việc thân thiện, chuyên nghiệp và nhiều cơ hội thăng tiến;- Chính sách hỗ trợ nhân viên có cơ hội sở hữu ĐTDĐ, laptop.. với nhiều ưu đãi;- Chế độ nghỉ mát, nghỉ hè trong và ngoài nước;- Chế độ theo Luật Lao động hiện hành và các phúc lợi theo quy định của Công ty(Bảo hiểm cao cấp cho Aon).Hạn nộp30-06-2017Hình thức nộpBấm ""NỘP HỒ SƠ"" để ứng tuyểnNộp hồ sơ"
"","20-03-2017","","Công ty TNHH Tư vấn Thiết kế Đầu tư Xây dựng Hoàng Tâm","Kỹ Sư Xây Dựng","Địa chỉ: D13 Đại An , Nguyễn Thị Định , Phường 9, Thành Phố Vũng Tàu","Kiến trúc/Nội thất, Thiết kế/Mỹ thuật, Xây dựng","","","","Nhân viên chính thức","2 năm","Đại học","184","","20-08-2017","Mô tả- Khảo sát hiện trạng, tư vấn khách hàng.- Thiết kế & trình bày phương án. - Triển khai thiết kế kỹ thuật thi công. - Giám sát tác giả, xử lý công trường.- Quản lý và tổ chức thi công công trình dân dụng và nội thất- Làm việc toàn thời gian hoặc bán thời gianYêu cầu- Làm việc nhóm- Tư vấn, trình bày ý tưởng- Phác họa tay, sử dụng thành thạo các phần mềm liên quan, đặt biệt sử dụng thành thạo phần mềm revitQuyền lợi- Lương cứng + các chế độ bảo hiểm theo quy định của pháp luật- Lương mềm theo doanh thu.- Đối với Thiết kế vẽ 3D : Lương hưởng theo thỏa thuận và khoán theo công trìnhHạn nộp20-08-2017Hình thức nộpBấm ""NỘP HỒ SƠ"" để ứng tuyểnNộp hồ sơ"
"","03-06-2017","","Công ty TNHH Minh Phúc","(Hà Nội) Kỹ Sư Hạ Tầng Đi Làm Ngay - Cầu Giấy - Giờ Hành Chính","Địa chỉ: 36 Trần Văn Dư, Phường 13, Quận Tân Bình","Công nghệ thông tin, Giao thông/Vận tải/Thủy lợi/Cầu đường, Kiến trúc/Nội thất","","","","Nhân viên chính thức","Chưa có kinh nghiệm","Trung cấp","26","","30-06-2017","Mô tả- Nội dung công việc cụ thể: thi công hệ thống mạng, thoại , camera, âm thanh thông báo của công trình.- Công ty cổ phần xây dựng môi trường Hà Nội.- Địa điểm làm việc: Cầu Giấy, Hà Nội.- Thời gian làm việc: giờ hành chính ( 7h - 11h và 13h30 - 17h30)Yêu cầu- Nam có sức khỏe tốt.- Tốt nghiệp trung cấp trở lên các chuyên ngành điện, điện tử, công nghệ thông tin,...- Mọi thắc mắc liên hệ ngay anh Nam: 0947596597 (trong giờ hành chính)Quyền lợi- Thu nhập: 6-9 triệu ( tuỳ theo năng lực làm việc, nếu ở lại công trường được hỗ trợ ăn)- ĐI LÀM NGAY NẾU ĐẠT PHỎNG VẤN.Hạn nộp30-06-2017Hình thức nộpBấm ""NỘP HỒ SƠ"" để ứng tuyểnTIN ĐÃ BỊ XÓA"
"","06-06-2017","","CÔNG TY CỔ PHẦN MAISON RETAIL MANAGEMENT INTERNATIONAL","Project Coordinator","Địa chỉ: Tầng 19, Tòa nhà Vincom, 72 Lê Thánh Tôn, Q.1, Hồ Chí Minh, Việt Nam","Bất động sản, Kiến trúc/Nội thất, Xây dựng","","","","Nhân viên chính thức","Trên 5 năm","Đại học","728","","30-06-2017","Mô tả- Phối hợp 3 bên (Principal (Hãng), Landlord (Đơn vi cho thuê mặt bằng), Contractor (Nhà thầu thi công) trong việc nhận, kiểm tra, phản hồi các bản vẽ kỹ thuật, thông tin dự án chuẩn bị xây dựng để đảm bảo thực hiện đúng tiến độ đã đặt ra.- Chịu trách nhiệm trước Trưởng Bộ phận và BGĐ về chất lượng, tiến độ và nghiệm thu chất lượng các công trình sau khi nhà thầu đã bàn giao.- Chịu trách nhiệm hoàn thành quy trình xây dựng cho cửa hàng mới sau khi tiếp nhận thông tin mặt bằng.- Quản lý, giám sát hiệu quả công việc của mỗi thành viên trong nhóm đảm bảo mục tiêu công việc của bộ phận hoàn thành tốt theo kế hoạch đã đặt ra.- Hỗ trợ các quản lý nhãn hàng tất cả các yêu cầu nhãn hàng đặt ra liên quan đến việc xây dựng, sữa chữa hoặc bảo trì cửa hàng...- Phối hợp với các Bộ phận trong công ty đảm bảo các thủ tục cần thiết với cơ quan nhà nước liên quan đến việc mở mới, sửa chữa,… cửa hàng, không giới hạn cả việc xin giấy phép Đăng Ký xây dựng, hoặc giấy phép quảng cáo cho Công ty hoặc các cửa hàng.- Tham gia, phối hợp với các bộ phận khác các công việc khai trương, mở cửa hàng mới.- Lên kế hoạch & triển khai các biện pháp cần thiết để đảm bảo việc kinh doanh không bị ảnh hưởng trong trường hợp mất điện (thuê máy phát điện….) và hoặc các trường hợp khác;- Lập, kiểm tra, kiểm soát, ký và chịu trách nhiệm trên các giấy tờ, tài liệu nghiệm thu công trình, các nguyên, vật liệu phục vụ cho công trình, cửa hàng…- Lập và gửi báo cáo hàng tháng, hàng quý, nửa năm và hàng năm… theo yêu cầu của Trưởng Bộ phận và Ban Tổng Giám đốc.- Báo cáo và thực hiện các công việc khác theo yêu cầu của COO, CEO, Trưởng Bộ phận. và các vị trí được Tổng Giám đốc chỉ định như Trợ lý TGĐ, Kiểm soát nội bộ.Yêu cầu- Sử dụng thành thạo các phần mềm đồ họa (Adobe Photoshop, Illustrator, InDesign…).- Kỹ năng, kinh nghiệm chuyên môn về thiết kế.- Có gout thẩm mỹ tốt, có khả năng sáng tạo các layout mang tính nghệ thuật và thời trang.- Khả năng đọc bản vẽ- Khả năng triển khai shop drawing- Khả năng bóc tách và tính toán khối lượng thiết kế để xây dựng dự toán- Khả năng sử dụng tiếng Anh chuyên ngành thiết kế, xây dựng+ Tần suất sử dụng kỹ năng đọc hiểu trong công việc: 90%+ Tần suất sử dụng kỹ năng nghe nói trong công việc:: 10%- Có kinh nghiệm quản lý thi công xây dựng – tối thiểu 02 năm- Khả năng lập kế hoạch và kiểm soát thực hiện kế hoạch- Có đầu óc tổ chức, quản lý công việc.- Kỹ năng giao tiếp tốt, khả năng thuyết phục.- Khả năng chịu áp lực cao trong công việc.- Khả năng làm việc độc lập và làm việc theo nhóm.- Có thể đi công tác hiện trường.Quyền lợi- Được hỗ trợ tiền cơm- Đi làm nhân viên được hỗ trợ tiền gửi xe. - Thưởng tháng lương 13, thưởng các ngày lễ tết theo quy định chung của công ty - Được công ty mua bảo hiểm tai nạn 24/24 sau 6 tháng làm việc - Đầy đủ chế độ theo Luật lao động (BHXH, BHYT, BTTN, .....) - Được đào tạo về nghiệp vụ, kỹ năng cần thiết để trở thành nhân viên chuyên nghiệp - Có nhiều cơ hội thăng tiến.Hạn nộp30-06-2017Hình thức nộpBấm ""NỘP HỒ SƠ"" để ứng tuyểnNộp hồ sơ"
"","06-06-2017","","Công Ty TNHH XD SX Kinh Doanh Dịch Vụ Saigon Mega","Motion Graphic","Địa chỉ: 61 Lò Lu, P. Trường Thạnh, Q. 9, Tp. Hồ Chí Minh","Kiến trúc/Nội thất","","","","Nhân viên chính thức","1 năm","Đại học","426","","30-06-2017","Mô tảLên ý tưởng và thiết kế các sản phẩm motion graphic theo yêu cầu team sản xuấtHỗ trợ thiết kế các sản phẩm khác theo yêu cầu chỉ đạoThiết kế đồ họa cho các cuộc họp, quảng cáo, thuyết trình đa phương tiện, trên các web, slide show.....Yêu cầuTốt nghiệp CĐ - DH chuyên ngànhCó kiến thức về thiết kế, màu sắc, có phong cách hiện đạiCó kiến thức về animotion, kịch bản, dựng phim, story board,Sử dụng thành tạo After Effect, photo shop, Illustrator, Flash,... các phần mêm thiết kế liên quan. Am hiểu Cinema3D, 4D và làm phim là 1 lợi thếĐam mê, sáng tạo, yêu thích công viêc,..Quyền lợiHưởng đầy đủ các chế độ theo quy định,.....Hạn nộp30-06-2017Hình thức nộpBấm ""NỘP HỒ SƠ"" để ứng tuyểnNộp hồ sơ"
"","26-05-2017","","Công Ty Cổ Phần Kến Trúc Đồng Xanh","Kỹ Sư Kết Cấu","Địa chỉ: 83 Lê Hồng Phong, TP Đà Nẵng","Kiến trúc/Nội thất, Xây dựng","","","","Nhân viên chính thức","5 năm","Đại học","74","","30-06-2017","Mô tả1. Thiết kế kết cấu, vạch giải pháp kết cấu, kiểm tra tính toán kết cấu bê tông cốt thép.;2. Dự toán, bốc tách khối lượng3. Giám sát công trìnhYêu cầu- Giới tính: Nam- Bằng cấp: Kỹ sư xây dựng công trình- Kinh nghiệm: 5 năm trở lên, có kinh nghiệm với nhà cải tạo, nhà khung thép hình.- Có kinh nghiệm đứng tối thiểu 3 công trình trở lên- Kỹ năng: Sử dụng thành thạo các phần mềm thiết kế chuyên ngành- Có tinh thần trách nhiệm cao, có thể tăng ca khi cần thiết theo yêu cầu của công việc- Có khả năng lãnh đạo, khả năng làm việc nhóm, có kĩ năng tư vấn và hỗ trợ tốt các thành viên trong Đội Thi công.- Đảm bảo thực hiện các dự án được giao đúng tiến độQuyền lợi- Môi trường làm việc chuyên nghiệp, năng động và thân thiện- Các chế độ phúc lợi theo quy định của Pháp luật và của Công ty.- Đóng BHXH, BHYT, BHTN theo quy định.- Thời gian làm việc: Theo công trình- Mức lương thỏa thuận theo năng lực và kinh nghiệm.Hạn nộp30-06-2017Hình thức nộpBấm ""NỘP HỒ SƠ"" để ứng tuyểnNộp hồ sơ"
"","06-06-2017","","CTY Cổ phần B.U.I Furniture","Nhân Viên Kế Toán Kho","Địa chỉ: Lô 33, Đường Số 7, KCN Tam Phước, Xã Tam Phước. Tp Biên Hòa, Tỉnh Đồng Nai","Kho vận/Vật tư/Thu mua, Kiến trúc/Nội thất, Tài chính/Kế toán/Kiểm toán","","","","Nhân viên chính thức","1 năm","Cao đẳng","618","","10-06-2017","Mô tả- Nhập xuất Kho (CCDC,Thành Phẩm, NVL…) - Thu/chi- Sắp xếp, lưu trữ, bảo quản tài liệu kế toán, bảo mật số liệu kế toán.- Kiểm tra theo dõi hợp đồng, báo giá, đơn đặt hàng mua, đơn đặt hàng bán, định mức tiêu hao NVL, đề nghị cấp vật tư bổ sung…- Lập chứng từ phiếu nhập kho và phiếu xuất kho (NVL,CCDC, Thành phẩm) trên cơ sở kiểm tra tính hợp lý, hợp lệ của chứng từ gốc và các chứng từ khác theo quy định vào phần mềm kế toán hiện hành.- Theo dõi và lập biên bản đối chiếu công nợ với từng khách hàng theo tháng.- Phối hợp với nhân viên kho kiểm kê và lập các báo cáo liên quan theo định kỳ.- Lập chứng từ thanh toán (Phiếu Thu/Chi) trên cơ sở kiểm tra tính hợp lý, hợp lệ của chứng từ gốc và các chứng từ khác theo qui định (thanh toán). Kiểm quỹ và lập báo cáo kiểm quỹ theo định kỳYêu cầuTốt nghiệp Cao đẳng trở lênKinh nghiệm 1 năm trở lênQuyền lợiTheo quy chế Công tyHạn nộp10-06-2017Hình thức nộpBấm ""NỘP HỒ SƠ"" để ứng tuyểnNộp hồ sơ"
"","09-05-2017","","Công ty Cổ Phần Trang Trí Nội Thất Tín Trung","Nhân Viên Kinh Doanh","Địa chỉ: Tầng 8, Số 85 Nguyễn Hữu Cầu, Quận 01, TP. HCM","Kiến trúc/Nội thất, Kinh doanh","","","","Nhân viên chính thức","2 năm","Cao đẳng","99","","21-06-2017","Mô tả-Tư vấn, thuyết trình cho khách hàng về các dịch vụ thiết kế, thi công trang trí nội thất (công trình dân dụng, văn phòng, khách sạn, nhà hàng, showroom v.v…), các sản phẩm nội thất.-Tìm kiếm và chăm sóc khách hàng, thu thập thông tin khách hàng,-Tìm kiếm và xây dựng quan hệ khách hàng qua các phương tiện internet, điện thoại, báo chí và kênh thông tin cá nhân khác;-Lập kế hoạch công tác, kinh doanh theo tuần, tháng của bản thân và báo cáo trình Trưởng phòng;-Lập báo giá và các kế hoạch thực hiện cung ứng dịch vụ, sản phẩm cho khách hàng sau khi đã được Trưởng phòng phê duyệt hoặc chỉnh sửa;-Soạn thảo báo giá, hợp đồng theo tiêu chuẩn quy định của Công ty;-Đàm phán, theo dõi, đề xuất xử lý các tình huống phát sinh trong quá trình triển khai thi công, thực hiện sản phẩm, dịch vụ cho khách hàng;-Chịu trách nhiệm trước Trưởng phòng về tiến độ, chất lượng, số lượng của dự án;-Được quyền đề xuất ý tưởng kinh doanh mới và tham gia các công việc nhằm tạo dựng thương hiệu trong các dự án của Công ty.- U7u tiên có khả năng đem dự án về cho công ty (sẽ được trích hoa hồng).Yêu cầu-Ưu tiên có kinh nghiệm về nội thất-Nắm bắt tình hình, giải quyết mọi vấn đề và thắc mắc của khách hàng nhanh-Tinh thần trách nhiệm cao-Hỗ trợ nhóm kinh doanh để hoàn thiện công việc được giao-Khả năng thuyết phục khách hàng và thao tác nhanh nhẹnQuyền lợi- Tham gia các chế độ BHXH, BHYT, BHTN, các chế độ khác theo quy định của Công ty và Luật lao động.- Xét tăng lương hàng năm.- Thưởng lương 13 hàng năm.- Làm việc từ thứ hai đến sáng thứ bảy, nghỉ chiều thứ bảy và nguyên ngày chủ nhật.- Nghỉ các ngày Lễ, tết theo đúng quy định nhà nước…Hạn nộp21-06-2017Hình thức nộpBấm ""NỘP HỒ SƠ"" để ứng tuyểnNộp hồ sơ"
"","30-05-2017","","Công ty TNHH Quảng cáo Hùng Sơn","Nhân Viên Thiết Kế Nội Thất","Địa chỉ: Số 234 Hoàng Công Chất, Cầu Diễn, Bắc Từ Liêm, Hà Nội","Kiến trúc/Nội thất, Thiết kế/Mỹ thuật","","","","Nhân viên chính thức","2 năm","Đại học","58","","30-06-2017","Mô tả- Thiết kế nội thất có tính ứng dụng cao.- Khảo sát, đưa ra ý tưởng, tư vấn cho khách hàng, đễ xuất phương án khả thi.- Lập kế hoạch công việc chi tiết, tuân thủ nghiêm túc quy trình thiết kế.- Phụ trách công việc liên quan đến các sản phẩm đã thiết kế.- Tham gia nghiên cứu sản phẩm mới phục vụ phát triển kinh doanh của công ty.- Đưa ra các chiến lược, ý tưởng thiết kế mới theo yêu cầu của Trưởng phòng.Yêu cầu- Am hiểu kiến thức về thiết kế, có quan điểm mỹ thuật, sử dụng tốt hình ảnh và màu sắc.- Trình độ chuyên môn kỹ thuật vững vàng. Sử dụng thành thạo thiết bị & phần mềm ứng dụng.- Có kinh nghiệm thiết kế nội thất- Thích ứng nhanh, có khả năng làm việc thực tế, am hiểu thị trường và nắm bắt được xu hướng mới.Quyền lợi- Lương + thưởng % công trình + Phụ cấp- Được hỗ trợ ăn trưa tại Công ty.- Được tham gia BHXH, BHYT, BHTN theo quy định.- Thưởng các ngày Lễ, Tết.- Chế độ khen thưởng, ngày lễ Tết, ốm đau, hiếu hỷ.... theo quy định của Công ty- Có cơ hội thăng tiến cao.- Được làm việc trong môi trường năng động, chuyên nghiệp.Hạn nộp30-06-2017Hình thức nộpBấm ""NỘP HỒ SƠ"" để ứng tuyểnNộp hồ sơ"
